{
  "name": "ThaiData UK \u2014 Thai Restaurant Data API",
  "version": "2.0",
  "description": "Free, open data on UK Thai restaurants. Sourced from FSA. No API key required.",
  "attribution": "Data from ThaiData.uk / Food Standards Agency",
  "updated": "2026-08-17",
  "total_uk": 1263,
  "cities_tracked": 254,
  "cities": [
    {
      "name": "London",
      "population": 8970000,
      "total_thai_businesses": 281,
      "restaurants": 230,
      "takeaways": 51,
      "per_100k": 3.1,
      "avg_hygiene_rating": 4.2,
      "postcode_areas": 99
    },
    {
      "name": "Leeds",
      "population": 812000,
      "total_thai_businesses": 27,
      "restaurants": 22,
      "takeaways": 5,
      "per_100k": 3.3,
      "avg_hygiene_rating": 4.5,
      "postcode_areas": 5
    },
    {
      "name": "York",
      "population": 211000,
      "total_thai_businesses": 24,
      "restaurants": 21,
      "takeaways": 3,
      "per_100k": 11.4,
      "avg_hygiene_rating": 4.2,
      "postcode_areas": 8
    },
    {
      "name": "Manchester",
      "population": 568000,
      "total_thai_businesses": 19,
      "restaurants": 16,
      "takeaways": 3,
      "per_100k": 3.3,
      "avg_hygiene_rating": 4.3,
      "postcode_areas": 10
    },
    {
      "name": "Edinburgh",
      "population": 548000,
      "total_thai_businesses": 19,
      "restaurants": 12,
      "takeaways": 7,
      "per_100k": 3.5,
      "avg_hygiene_rating": 0,
      "postcode_areas": 7
    },
    {
      "name": "Swansea",
      "population": 247000,
      "total_thai_businesses": 15,
      "restaurants": 13,
      "takeaways": 2,
      "per_100k": 6.1,
      "avg_hygiene_rating": 3.8,
      "postcode_areas": 5
    },
    {
      "name": "Bristol",
      "population": 483000,
      "total_thai_businesses": 14,
      "restaurants": 12,
      "takeaways": 2,
      "per_100k": 2.9,
      "avg_hygiene_rating": 4.7,
      "postcode_areas": 6
    },
    {
      "name": "Richmond-Upon-Thames",
      "population": null,
      "total_thai_businesses": 14,
      "restaurants": 14,
      "takeaways": 0,
      "per_100k": null,
      "avg_hygiene_rating": 4.5,
      "postcode_areas": 4
    },
    {
      "name": "Brighton",
      "population": 277000,
      "total_thai_businesses": 12,
      "restaurants": 11,
      "takeaways": 1,
      "per_100k": 4.3,
      "avg_hygiene_rating": 4.9,
      "postcode_areas": 3
    },
    {
      "name": "Cornwall",
      "population": 575000,
      "total_thai_businesses": 12,
      "restaurants": 10,
      "takeaways": 2,
      "per_100k": 2.1,
      "avg_hygiene_rating": 5.0,
      "postcode_areas": 4
    },
    {
      "name": "Somerset",
      "population": 580000,
      "total_thai_businesses": 11,
      "restaurants": 9,
      "takeaways": 2,
      "per_100k": 1.9,
      "avg_hygiene_rating": 4.7,
      "postcode_areas": 6
    },
    {
      "name": "Bournemouth",
      "population": 401000,
      "total_thai_businesses": 11,
      "restaurants": 9,
      "takeaways": 2,
      "per_100k": 2.7,
      "avg_hygiene_rating": 4.6,
      "postcode_areas": 6
    },
    {
      "name": "Bath",
      "population": 196000,
      "total_thai_businesses": 10,
      "restaurants": 10,
      "takeaways": 0,
      "per_100k": 5.1,
      "avg_hygiene_rating": 4.5,
      "postcode_areas": 2
    },
    {
      "name": "Dorset",
      "population": 380000,
      "total_thai_businesses": 10,
      "restaurants": 7,
      "takeaways": 3,
      "per_100k": 2.6,
      "avg_hygiene_rating": 4.8,
      "postcode_areas": 6
    },
    {
      "name": "Buckinghamshire",
      "population": 560000,
      "total_thai_businesses": 10,
      "restaurants": 10,
      "takeaways": 0,
      "per_100k": 1.8,
      "avg_hygiene_rating": 4.5,
      "postcode_areas": 7
    },
    {
      "name": "Hertfordshire",
      "population": 1200000,
      "total_thai_businesses": 10,
      "restaurants": 8,
      "takeaways": 2,
      "per_100k": 0.8,
      "avg_hygiene_rating": 4.3,
      "postcode_areas": 5
    },
    {
      "name": "Windsor and Maidenhead",
      "population": 158000,
      "total_thai_businesses": 9,
      "restaurants": 8,
      "takeaways": 1,
      "per_100k": 5.7,
      "avg_hygiene_rating": 4.6,
      "postcode_areas": 2
    },
    {
      "name": "Torbay",
      "population": null,
      "total_thai_businesses": 9,
      "restaurants": 5,
      "takeaways": 4,
      "per_100k": null,
      "avg_hygiene_rating": 4.9,
      "postcode_areas": 5
    },
    {
      "name": "Herefordshire",
      "population": 195000,
      "total_thai_businesses": 9,
      "restaurants": 8,
      "takeaways": 1,
      "per_100k": 4.6,
      "avg_hygiene_rating": 4.8,
      "postcode_areas": 6
    },
    {
      "name": "Sheffield",
      "population": 584000,
      "total_thai_businesses": 9,
      "restaurants": 9,
      "takeaways": 0,
      "per_100k": 1.5,
      "avg_hygiene_rating": 4.6,
      "postcode_areas": 4
    },
    {
      "name": "Westmorland and Furness",
      "population": null,
      "total_thai_businesses": 9,
      "restaurants": 7,
      "takeaways": 2,
      "per_100k": null,
      "avg_hygiene_rating": 4.8,
      "postcode_areas": 4
    },
    {
      "name": "Newcastle",
      "population": 307000,
      "total_thai_businesses": 8,
      "restaurants": 8,
      "takeaways": 0,
      "per_100k": 2.6,
      "avg_hygiene_rating": 4.6,
      "postcode_areas": 1
    },
    {
      "name": "Norwich",
      "population": 148000,
      "total_thai_businesses": 8,
      "restaurants": 6,
      "takeaways": 2,
      "per_100k": 5.4,
      "avg_hygiene_rating": 4.5,
      "postcode_areas": 3
    },
    {
      "name": "Oxford",
      "population": 164000,
      "total_thai_businesses": 8,
      "restaurants": 8,
      "takeaways": 0,
      "per_100k": 4.9,
      "avg_hygiene_rating": 4.8,
      "postcode_areas": 3
    },
    {
      "name": "Birmingham",
      "population": 1166000,
      "total_thai_businesses": 8,
      "restaurants": 6,
      "takeaways": 2,
      "per_100k": 0.7,
      "avg_hygiene_rating": 4.4,
      "postcode_areas": 6
    },
    {
      "name": "Thanet",
      "population": null,
      "total_thai_businesses": 8,
      "restaurants": 8,
      "takeaways": 0,
      "per_100k": null,
      "avg_hygiene_rating": 4.9,
      "postcode_areas": 2
    },
    {
      "name": "Huddersfield",
      "population": 437000,
      "total_thai_businesses": 8,
      "restaurants": 6,
      "takeaways": 2,
      "per_100k": 1.8,
      "avg_hygiene_rating": 4.0,
      "postcode_areas": 5
    },
    {
      "name": "Shropshire",
      "population": 325000,
      "total_thai_businesses": 8,
      "restaurants": 6,
      "takeaways": 2,
      "per_100k": 2.5,
      "avg_hygiene_rating": 3.9,
      "postcode_areas": 5
    },
    {
      "name": "Wiltshire",
      "population": 520000,
      "total_thai_businesses": 8,
      "restaurants": 7,
      "takeaways": 1,
      "per_100k": 1.5,
      "avg_hygiene_rating": 4.4,
      "postcode_areas": 5
    },
    {
      "name": "Elmbridge",
      "population": null,
      "total_thai_businesses": 8,
      "restaurants": 8,
      "takeaways": 0,
      "per_100k": null,
      "avg_hygiene_rating": 3.5,
      "postcode_areas": 3
    },
    {
      "name": "Tendring",
      "population": null,
      "total_thai_businesses": 7,
      "restaurants": 5,
      "takeaways": 2,
      "per_100k": null,
      "avg_hygiene_rating": 4.0,
      "postcode_areas": 1
    },
    {
      "name": "Cardiff",
      "population": 372000,
      "total_thai_businesses": 7,
      "restaurants": 7,
      "takeaways": 0,
      "per_100k": 1.9,
      "avg_hygiene_rating": 4.6,
      "postcode_areas": 2
    },
    {
      "name": "Warrington",
      "population": 212000,
      "total_thai_businesses": 7,
      "restaurants": 6,
      "takeaways": 1,
      "per_100k": 3.3,
      "avg_hygiene_rating": 3.6,
      "postcode_areas": 4
    },
    {
      "name": "Central Bedfordshire",
      "population": 300000,
      "total_thai_businesses": 7,
      "restaurants": 7,
      "takeaways": 0,
      "per_100k": 2.3,
      "avg_hygiene_rating": 3.7,
      "postcode_areas": 5
    },
    {
      "name": "Cheshire West and Chester",
      "population": 357000,
      "total_thai_businesses": 7,
      "restaurants": 5,
      "takeaways": 2,
      "per_100k": 2.0,
      "avg_hygiene_rating": 4.7,
      "postcode_areas": 4
    },
    {
      "name": "Blackpool",
      "population": 142000,
      "total_thai_businesses": 7,
      "restaurants": 3,
      "takeaways": 4,
      "per_100k": 4.9,
      "avg_hygiene_rating": 4.4,
      "postcode_areas": 5
    },
    {
      "name": "Leicester",
      "population": 374000,
      "total_thai_businesses": 7,
      "restaurants": 4,
      "takeaways": 3,
      "per_100k": 1.9,
      "avg_hygiene_rating": 4.4,
      "postcode_areas": 5
    },
    {
      "name": "Belfast",
      "population": 345000,
      "total_thai_businesses": 7,
      "restaurants": 6,
      "takeaways": 1,
      "per_100k": 2.0,
      "avg_hygiene_rating": 3.6,
      "postcode_areas": 5
    },
    {
      "name": "Maidstone",
      "population": null,
      "total_thai_businesses": 7,
      "restaurants": 6,
      "takeaways": 1,
      "per_100k": null,
      "avg_hygiene_rating": 3.9,
      "postcode_areas": 1
    },
    {
      "name": "St Albans City",
      "population": null,
      "total_thai_businesses": 7,
      "restaurants": 7,
      "takeaways": 0,
      "per_100k": null,
      "avg_hygiene_rating": 4.6,
      "postcode_areas": 3
    },
    {
      "name": "Glasgow",
      "population": 635000,
      "total_thai_businesses": 7,
      "restaurants": 5,
      "takeaways": 2,
      "per_100k": 1.1,
      "avg_hygiene_rating": 0,
      "postcode_areas": 5
    },
    {
      "name": "New Forest",
      "population": null,
      "total_thai_businesses": 6,
      "restaurants": 6,
      "takeaways": 0,
      "per_100k": null,